{
  "$schema": "https://json-schema.org/draft/2020-12/schema",
  "$id": "https://redhat.com/schemas/i18n-pipeline/catalog-validation-config.json",
  "title": "Catalog validation configuration",
  "description": "Consumer-owned catalog checks, built-in FEO synchronization, and generated-file synchronization for i18n-pipeline validate-project.",
  "type": "object",
  "required": ["version", "checks"],
  "properties": {
    "version": {
      "const": 1
    },
    "tmsConfig": {
      "$ref": "#/$defs/path",
      "description": "Phrase TMS config whose source catalog and target locales become a check. Targets are checked once their output file exists."
    },
    "checks": {
      "type": "array",
      "items": {
        "type": "object",
        "required": ["source", "targets"],
        "properties": {
          "source": {
            "$ref": "#/$defs/catalog"
          },
          "targets": {
            "type": "array",
            "items": {
              "$ref": "#/$defs/catalog"
            }
          }
        },
        "additionalProperties": false
      }
    },
    "generated": {
      "type": "array",
      "items": {
        "type": "object",
        "required": ["path", "command", "args"],
        "properties": {
          "path": {
            "$ref": "#/$defs/path"
          },
          "adapter": {
            "type": "string",
            "minLength": 1
          },
          "locale": {
            "type": "string",
            "minLength": 1
          },
          "role": {
            "enum": ["source", "target"]
          },
          "options": {
            "type": "object"
          },
          "command": {
            "type": "string",
            "minLength": 1
          },
          "args": {
            "type": "array",
            "minItems": 1,
            "items": {
              "type": "string"
            },
            "contains": {
              "type": "string",
              "pattern": "\\{output\\}"
            },
            "description": "Argument array passed without a shell; include {output} in the output-file argument."
          },
          "updateCommand": {
            "type": "string",
            "minLength": 1
          }
        },
        "additionalProperties": false,
        "description": "Without adapter, the checked-in and generated files are compared as plain JSON.",
        "if": {
          "required": ["adapter"],
          "properties": {
            "adapter": true
          }
        },
        "then": {
          "required": ["locale", "role"],
          "properties": {
            "locale": true,
            "role": true
          }
        },
        "else": {
          "not": {
            "anyOf": [
              {
                "required": ["locale"],
                "properties": {
                  "locale": true
                }
              },
              {
                "required": ["role"],
                "properties": {
                  "role": true
                }
              },
              {
                "required": ["options"],
                "properties": {
                  "options": true
                }
              }
            ]
          }
        }
      }
    },
    "catalogDirectories": {
      "type": "array",
      "description": "Directories whose catalog files must all be declared by the plan (checks, TMS targets, generated entries, or FEO source and locale entries).",
      "items": {
        "type": "object",
        "required": ["path"],
        "properties": {
          "path": {
            "$ref": "#/$defs/path"
          },
          "extension": {
            "type": "string",
            "pattern": "^\\.[^/\\\\]+$",
            "default": ".json"
          }
        },
        "additionalProperties": false
      }
    },
    "feo": {
      "type": "array",
      "description": "Built-in, read-only synchronization checks for FEO Frontend templates and their catalogs.",
      "items": {
        "type": "object",
        "required": ["template", "source", "locales"],
        "properties": {
          "template": {
            "$ref": "#/$defs/path",
            "description": "Repository-relative Frontend template."
          },
          "source": {
            "$ref": "#/$defs/path",
            "description": "Committed catalog generated by feo extract."
          },
          "locales": {
            "type": "object",
            "description": "Map of non-English locale ids in canonical BCP 47 casing (for example fr, ja, zh-CN) to repository-relative flat locale JSON files; this may be empty. Every locale with a spec.locales block in the template must be listed. If neither a locale file nor a spec.locales block exists, validation reports the locale as undelivered and skips it with a warning.",
            "propertyNames": {
              "pattern": "^[a-z]{2,3}(-[A-Z][a-z]{3})?(-([A-Z]{2}|[0-9]{3}))?$",
              "not": { "const": "en" },
              "description": "Canonical BCP 47 locale id (language, optional script, optional region, such as fr, zh-CN or zh-Hant-TW), accepted by FEO inline. English is the source language. Matches the Frontend operator CRD rule for spec.locales keys."
            },
            "additionalProperties": {
              "$ref": "#/$defs/path"
            }
          }
        },
        "additionalProperties": false
      }
    },
    "sourceLint": {
      "type": "object",
      "description": "Optional source-code lint settings for i18n-pipeline validate-ci; ignored by validate-project.",
      "properties": {
        "files": {
          "type": "array",
          "items": {
            "$ref": "#/$defs/path"
          },
          "description": "Repository-relative source globs; defaults to src/**/*.{js,jsx,ts,tsx}."
        },
        "catalog": {
          "$ref": "#/$defs/path",
          "description": "Repository-relative default source catalog checked for missing message IDs."
        }
      },
      "additionalProperties": false
    }
  },
  "additionalProperties": false,
  "anyOf": [
    {
      "required": ["tmsConfig"],
      "properties": {
        "tmsConfig": {
          "type": "string"
        }
      }
    },
    {
      "properties": {
        "checks": {
          "type": "array",
          "minItems": 1
        }
      }
    },
    {
      "required": ["generated"],
      "properties": {
        "generated": {
          "type": "array",
          "minItems": 1
        }
      }
    },
    {
      "required": ["feo"],
      "properties": {
        "feo": {
          "type": "array",
          "minItems": 1
        }
      }
    }
  ],
  "$defs": {
    "path": {
      "type": "string",
      "minLength": 1,
      "pattern": "^(?!/)(?![A-Za-z]:)(?!.*\\\\)(?!.*//)(?!.*(?:^|/)\\.\\.?(/|$)).+$",
      "description": "Repository-relative path without parent traversal."
    },
    "catalog": {
      "type": "object",
      "required": ["path", "adapter", "locale"],
      "properties": {
        "path": {
          "$ref": "#/$defs/path"
        },
        "adapter": {
          "type": "string",
          "minLength": 1
        },
        "locale": {
          "type": "string",
          "minLength": 1
        },
        "options": {
          "type": "object"
        }
      },
      "additionalProperties": false
    }
  }
}
